D1: 2024 | E1: 年岁数属相生肖对照表一网名张先生铆钉厂张东良
A2: 出生年份 | B2: =D1 -> 2024 | C2: =B2-1 -> 2023 | D2: =C2-1 -> 2022 | E2: =D2-1 -> 2021 | F2: =E2-1 -> 2020 | G2: =F2-1 -> 2019 | H2: =G2-1 -> 2018 | I2: =H2-1 -> 2017 | J2: =I2-1 -> 2016 | K2: =J2-1 -> 2015 | L2: =K2-1 -> 2014 | M2: =L2-1 -> 2013
A3: 生肖 | B3: =MID("鼠牛虎兔龙蛇马羊猴鸡狗猪",MOD(MID(B2,1,4)-4,12)+1,1) -> 龙 | C3: =MID("鼠牛虎兔龙蛇马羊猴鸡狗猪",MOD(MID(C2,1,4)-4,12)+1,1) -> 兔 | D3: =MID("鼠牛虎兔龙蛇马羊猴鸡狗猪",MOD(MID(D2,1,4)-4,12)+1,1) -> 虎 | E3: =MID("鼠牛虎兔龙蛇马羊猴鸡狗猪",MOD(MID(E2,1,4)-4,12)+1,1) -> 牛 | F3: =MID("鼠牛虎兔龙蛇马羊猴鸡狗猪",MOD(MID(F2,1,4)-4,12)+1,1) -> 鼠 | G3: =MID("鼠牛虎兔龙蛇马羊猴鸡狗猪",MOD(MID(G2,1,4)-4,12)+1,1) -> 猪 | H3: =MID("鼠牛虎兔龙蛇马羊猴鸡狗猪",MOD(MID(H2,1,4)-4,12)+1,1) -> 狗 | I3: =MID("鼠牛虎兔龙蛇马羊猴鸡狗猪",MOD(MID(I2,1,4)-4,12)+1,1) -> 鸡 | J3: =MID("鼠牛虎兔龙蛇马羊猴鸡狗猪",MOD(MID(J2,1,4)-4,12)+1,1) -> 猴 | K3: =MID("鼠牛虎兔龙蛇马羊猴鸡狗猪",MOD(MID(K2,1,4)-4,12)+1,1) -> 羊 | L3: =MID("鼠牛虎兔龙蛇马羊猴鸡狗猪",MOD(MID(L2,1,4)-4,12)+1,1) -> 马 | M3: =MID("鼠牛虎兔龙蛇马羊猴鸡狗猪",MOD(MID(M2,1,4)-4,12)+1,1) -> 蛇
A4: 虚岁 | B4: 1 | C4: 2 | D4: 3 | E4: 4 | F4: 5 | G4: 6 | H4: 7 | I4: 8 | J4: 9 | K4: 10 | L4: 11 | M4: 12
A5: 出生年份 | B5: =M2-1 -> 2012 | C5: =B5-1 -> 2011 | D5: =C5-1 -> 2010 | E5: =D5-1 -> 2009 | F5: =E5-1 -> 2008 | G5: =F5-1 -> 2007 | H5: =G5-1 -> 2006 | I5: =H5-1 -> 2005 | J5: =I5-1 -> 2004 | K5: =J5-1 -> 2003 | L5: =K5-1 -> 2002 | M5: =L5-1 -> 2001
A6: 生肖 | B6: =MID("鼠牛虎兔龙蛇马羊猴鸡狗猪",MOD(MID(B5,1,4)-4,12)+1,1) -> 龙 | C6: =MID("鼠牛虎兔龙蛇马羊猴鸡狗猪",MOD(MID(C5,1,4)-4,12)+1,1) -> 兔 | D6: =MID("鼠牛虎兔龙蛇马羊猴鸡狗猪",MOD(MID(D5,1,4)-4,12)+1,1) -> 虎 | E6: =MID("鼠牛虎兔龙蛇马羊猴鸡狗猪",MOD(MID(E5,1,4)-4,12)+1,1) -> 牛 | F6: =MID("鼠牛虎兔龙蛇马羊猴鸡狗猪",MOD(MID(F5,1,4)-4,12)+1,1) -> 鼠 | G6: =MID("鼠牛虎兔龙蛇马羊猴鸡狗猪",MOD(MID(G5,1,4)-4,12)+1,1) -> 猪 | H6: =MID("鼠牛虎兔龙蛇马羊猴鸡狗猪",MOD(MID(H5,1,4)-4,12)+1,1) -> 狗 | I6: =MID("鼠牛虎兔龙蛇马羊猴鸡狗猪",MOD(MID(I5,1,4)-4,12)+1,1) -> 鸡 | J6: =MID("鼠牛虎兔龙蛇马羊猴鸡狗猪",MOD(MID(J5,1,4)-4,12)+1,1) -> 猴 | K6: =MID("鼠牛虎兔龙蛇马羊猴鸡狗猪",MOD(MID(K5,1,4)-4,12)+1,1) -> 羊 | L6: =MID("鼠牛虎兔龙蛇马羊猴鸡狗猪",MOD(MID(L5,1,4)-4,12)+1,1) -> 马 | M6: =MID("鼠牛虎兔龙蛇马羊猴鸡狗猪",MOD(MID(M5,1,4)-4,12)+1,1) -> 蛇
A7: 虚岁 | B7: =M4+1 -> 13 | C7: =B7+1 -> 14 | D7: =C7+1 -> 15 | E7: =D7+1 -> 16 | F7: =E7+1 -> 17 | G7: =F7+1 -> 18 | H7: =G7+1 -> 19 | I7: =H7+1 -> 20 | J7: =I7+1 -> 21 | K7: =J7+1 -> 22 | L7: =K7+1 -> 23 | M7: =L7+1 -> 24
A8: 出生年份 | B8: =M5-1 -> 2000 | C8: =B8-1 -> 1999 | D8: =C8-1 -> 1998 | E8: =D8-1 -> 1997 | F8: =E8-1 -> 1996 | G8: =F8-1 -> 1995 | H8: =G8-1 -> 1994 | I8: =H8-1 -> 1993 | J8: =I8-1 -> 1992 | K8: =J8-1 -> 1991 | L8: =K8-1 -> 1990 | M8: =L8-1 -> 1989
A9: 生肖 | B9: =MID("鼠牛虎兔龙蛇马羊猴鸡狗猪",MOD(MID(B8,1,4)-4,12)+1,1) -> 龙 | C9: =MID("鼠牛虎兔龙蛇马羊猴鸡狗猪",MOD(MID(C8,1,4)-4,12)+1,1) -> 兔 | D9: =MID("鼠牛虎兔龙蛇马羊猴鸡狗猪",MOD(MID(D8,1,4)-4,12)+1,1) -> 虎 | E9: =MID("鼠牛虎兔龙蛇马羊猴鸡狗猪",MOD(MID(E8,1,4)-4,12)+1,1) -> 牛 | F9: =MID("鼠牛虎兔龙蛇马羊猴鸡狗猪",MOD(MID(F8,1,4)-4,12)+1,1) -> 鼠 | G9: =MID("鼠牛虎兔龙蛇马羊猴鸡狗猪",MOD(MID(G8,1,4)-4,12)+1,1) -> 猪 | H9: =MID("鼠牛虎兔龙蛇马羊猴鸡狗猪",MOD(MID(H8,1,4)-4,12)+1,1) -> 狗 | I9: =MID("鼠牛虎兔龙蛇马羊猴鸡狗猪",MOD(MID(I8,1,4)-4,12)+1,1) -> 鸡 | J9: =MID("鼠牛虎兔龙蛇马羊猴鸡狗猪",MOD(MID(J8,1,4)-4,12)+1,1) -> 猴 | K9: =MID("鼠牛虎兔龙蛇马羊猴鸡狗猪",MOD(MID(K8,1,4)-4,12)+1,1) -> 羊 | L9: =MID("鼠牛虎兔龙蛇马羊猴鸡狗猪",MOD(MID(L8,1,4)-4,12)+1,1) -> 马 | M9: =MID("鼠牛虎兔龙蛇马羊猴鸡狗猪",MOD(MID(M8,1,4)-4,12)+1,1) -> 蛇
A10: 虚岁 | B10: =M7+1 -> 25 | C10: =B10+1 -> 26 | D10: =C10+1 -> 27 | E10: =D10+1 -> 28 | F10: =E10+1 -> 29 | G10: =F10+1 -> 30 | H10: =G10+1 -> 31 | I10: =H10+1 -> 32 | J10: =I10+1 -> 33 | K10: =J10+1 -> 34 | L10: =K10+1 -> 35 | M10: =L10+1 -> 36
A11: 出生年份 | B11: =M8-1 -> 1988 | C11: =B11-1 -> 1987 | D11: =C11-1 -> 1986 | E11: =D11-1 -> 1985 | F11: =E11-1 -> 1984 | G11: =F11-1 -> 1983 | H11: =G11-1 -> 1982 | I11: =H11-1 -> 1981 | J11: =I11-1 -> 1980 | K11: =J11-1 -> 1979 | L11: =K11-1 -> 1978 | M11: =L11-1 -> 1977
A12: 生肖 | B12: =MID("鼠牛虎兔龙蛇马羊猴鸡狗猪",MOD(MID(B11,1,4)-4,12)+1,1) -> 龙 | C12: =MID("鼠牛虎兔龙蛇马羊猴鸡狗猪",MOD(MID(C11,1,4)-4,12)+1,1) -> 兔 | D12: =MID("鼠牛虎兔龙蛇马羊猴鸡狗猪",MOD(MID(D11,1,4)-4,12)+1,1) -> 虎 | E12: =MID("鼠牛虎兔龙蛇马羊猴鸡狗猪",MOD(MID(E11,1,4)-4,12)+1,1) -> 牛 | F12: =MID("鼠牛虎兔龙蛇马羊猴鸡狗猪",MOD(MID(F11,1,4)-4,12)+1,1) -> 鼠 | G12: =MID("鼠牛虎兔龙蛇马羊猴鸡狗猪",MOD(MID(G11,1,4)-4,12)+1,1) -> 猪 | H12: =MID("鼠牛虎兔龙蛇马羊猴鸡狗猪",MOD(MID(H11,1,4)-4,12)+1,1) -> 狗 | I12: =MID("鼠牛虎兔龙蛇马羊猴鸡狗猪",MOD(MID(I11,1,4)-4,12)+1,1) -> 鸡 | J12: =MID("鼠牛虎兔龙蛇马羊猴鸡狗猪",MOD(MID(J11,1,4)-4,12)+1,1) -> 猴 | K12: =MID("鼠牛虎兔龙蛇马羊猴鸡狗猪",MOD(MID(K11,1,4)-4,12)+1,1) -> 羊 | L12: =MID("鼠牛虎兔龙蛇马羊猴鸡狗猪",MOD(MID(L11,1,4)-4,12)+1,1) -> 马 | M12: =MID("鼠牛虎兔龙蛇马羊猴鸡狗猪",MOD(MID(M11,1,4)-4,12)+1,1) -> 蛇
A13: 虚岁 | B13: =M10+1 -> 37 | C13: =B13+1 -> 38 | D13: =C13+1 -> 39 | E13: =D13+1 -> 40 | F13: =E13+1 -> 41 | G13: =F13+1 -> 42 | H13: =G13+1 -> 43 | I13: =H13+1 -> 44 | J13: =I13+1 -> 45 | K13: =J13+1 -> 46 | L13: =K13+1 -> 47 | M13: =L13+1 -> 48
A14: 出生年份 | B14: =M11-1 -> 1976 | C14: =B14-1 -> 1975 | D14: =C14-1 -> 1974 | E14: =D14-1 -> 1973 | F14: =E14-1 -> 1972 | G14: =F14-1 -> 1971 | H14: =G14-1 -> 1970 | I14: =H14-1 -> 1969 | J14: =I14-1 -> 1968 | K14: =J14-1 -> 1967 | L14: =K14-1 -> 1966 | M14: =L14-1 -> 1965
A15: 生肖 | B15: =MID("鼠牛虎兔龙蛇马羊猴鸡狗猪",MOD(MID(B14,1,4)-4,12)+1,1) -> 龙 | C15: =MID("鼠牛虎兔龙蛇马羊猴鸡狗猪",MOD(MID(C14,1,4)-4,12)+1,1) -> 兔 | D15: =MID("鼠牛虎兔龙蛇马羊猴鸡狗猪",MOD(MID(D14,1,4)-4,12)+1,1) -> 虎 | E15: =MID("鼠牛虎兔龙蛇马羊猴鸡狗猪",MOD(MID(E14,1,4)-4,12)+1,1) -> 牛 | F15: =MID("鼠牛虎兔龙蛇马羊猴鸡狗猪",MOD(MID(F14,1,4)-4,12)+1,1) -> 鼠 | G15: =MID("鼠牛虎兔龙蛇马羊猴鸡狗猪",MOD(MID(G14,1,4)-4,12)+1,1) -> 猪 | H15: =MID("鼠牛虎兔龙蛇马羊猴鸡狗猪",MOD(MID(H14,1,4)-4,12)+1,1) -> 狗 | I15: =MID("鼠牛虎兔龙蛇马羊猴鸡狗猪",MOD(MID(I14,1,4)-4,12)+1,1) -> 鸡 | J15: =MID("鼠牛虎兔龙蛇马羊猴鸡狗猪",MOD(MID(J14,1,4)-4,12)+1,1) -> 猴 | K15: =MID("鼠牛虎兔龙蛇马羊猴鸡狗猪",MOD(MID(K14,1,4)-4,12)+1,1) -> 羊 | L15: =MID("鼠牛虎兔龙蛇马羊猴鸡狗猪",MOD(MID(L14,1,4)-4,12)+1,1) -> 马 | M15: =MID("鼠牛虎兔龙蛇马羊猴鸡狗猪",MOD(MID(M14,1,4)-4,12)+1,1) -> 蛇
A16: 虚岁 | B16: =M13+1 -> 49 | C16: =B16+1 -> 50 | D16: =C16+1 -> 51 | E16: =D16+1 -> 52 | F16: =E16+1 -> 53 | G16: =F16+1 -> 54 | H16: =G16+1 -> 55 | I16: =H16+1 -> 56 | J16: =I16+1 -> 57 | K16: =J16+1 -> 58 | L16: =K16+1 -> 59 | M16: =L16+1 -> 60
A17: 出生年份 | B17: =M14-1 -> 1964 | C17: =B17-1 -> 1963 | D17: =C17-1 -> 1962 | E17: =D17-1 -> 1961 | F17: =E17-1 -> 1960 | G17: =F17-1 -> 1959 | H17: =G17-1 -> 1958 | I17: =H17-1 -> 1957 | J17: =I17-1 -> 1956 | K17: =J17-1 -> 1955 | L17: =K17-1 -> 1954 | M17: =L17-1 -> 1953
A18: 生肖 | B18: =MID("鼠牛虎兔龙蛇马羊猴鸡狗猪",MOD(MID(B17,1,4)-4,12)+1,1) -> 龙 | C18: =MID("鼠牛虎兔龙蛇马羊猴鸡狗猪",MOD(MID(C17,1,4)-4,12)+1,1) -> 兔 | D18: =MID("鼠牛虎兔龙蛇马羊猴鸡狗猪",MOD(MID(D17,1,4)-4,12)+1,1) -> 虎 | E18: =MID("鼠牛虎兔龙蛇马羊猴鸡狗猪",MOD(MID(E17,1,4)-4,12)+1,1) -> 牛 | F18: =MID("鼠牛虎兔龙蛇马羊猴鸡狗猪",MOD(MID(F17,1,4)-4,12)+1,1) -> 鼠 | G18: =MID("鼠牛虎兔龙蛇马羊猴鸡狗猪",MOD(MID(G17,1,4)-4,12)+1,1) -> 猪 | H18: =MID("鼠牛虎兔龙蛇马羊猴鸡狗猪",MOD(MID(H17,1,4)-4,12)+1,1) -> 狗 | I18: =MID("鼠牛虎兔龙蛇马羊猴鸡狗猪",MOD(MID(I17,1,4)-4,12)+1,1) -> 鸡 | J18: =MID("鼠牛虎兔龙蛇马羊猴鸡狗猪",MOD(MID(J17,1,4)-4,12)+1,1) -> 猴 | K18: =MID("鼠牛虎兔龙蛇马羊猴鸡狗猪",MOD(MID(K17,1,4)-4,12)+1,1) -> 羊 | L18: =MID("鼠牛虎兔龙蛇马羊猴鸡狗猪",MOD(MID(L17,1,4)-4,12)+1,1) -> 马 | M18: =MID("鼠牛虎兔龙蛇马羊猴鸡狗猪",MOD(MID(M17,1,4)-4,12)+1,1) -> 蛇
A19: 虚岁 | B19: =M16+1 -> 61 | C19: =B19+1 -> 62 | D19: =C19+1 -> 63 | E19: =D19+1 -> 64 | F19: =E19+1 -> 65 | G19: =F19+1 -> 66 | H19: =G19+1 -> 67 | I19: =H19+1 -> 68 | J19: =I19+1 -> 69 | K19: =J19+1 -> 70 | L19: =K19+1 -> 71 | M19: =L19+1 -> 72
A20: 出生年份 | B20: =M17-1 -> 1952 | C20: =B20-1 -> 1951 | D20: =C20-1 -> 1950 | E20: =D20-1 -> 1949 | F20: =E20-1 -> 1948 | G20: =F20-1 -> 1947 | H20: =G20-1 -> 1946 | I20: =H20-1 -> 1945 | J20: =I20-1 -> 1944 | K20: =J20-1 -> 1943 | L20: =K20-1 -> 1942 | M20: =L20-1 -> 1941
A21: 生肖 | B21: =MID("鼠牛虎兔龙蛇马羊猴鸡狗猪",MOD(MID(B20,1,4)-4,12)+1,1) -> 龙 | C21: =MID("鼠牛虎兔龙蛇马羊猴鸡狗猪",MOD(MID(C20,1,4)-4,12)+1,1) -> 兔 | D21: =MID("鼠牛虎兔龙蛇马羊猴鸡狗猪",MOD(MID(D20,1,4)-4,12)+1,1) -> 虎 | E21: =MID("鼠牛虎兔龙蛇马羊猴鸡狗猪",MOD(MID(E20,1,4)-4,12)+1,1) -> 牛 | F21: =MID("鼠牛虎兔龙蛇马羊猴鸡狗猪",MOD(MID(F20,1,4)-4,12)+1,1) -> 鼠 | G21: =MID("鼠牛虎兔龙蛇马羊猴鸡狗猪",MOD(MID(G20,1,4)-4,12)+1,1) -> 猪 | H21: =MID("鼠牛虎兔龙蛇马羊猴鸡狗猪",MOD(MID(H20,1,4)-4,12)+1,1) -> 狗 | I21: =MID("鼠牛虎兔龙蛇马羊猴鸡狗猪",MOD(MID(I20,1,4)-4,12)+1,1) -> 鸡 | J21: =MID("鼠牛虎兔龙蛇马羊猴鸡狗猪",MOD(MID(J20,1,4)-4,12)+1,1) -> 猴 | K21: =MID("鼠牛虎兔龙蛇马羊猴鸡狗猪",MOD(MID(K20,1,4)-4,12)+1,1) -> 羊 | L21: =MID("鼠牛虎兔龙蛇马羊猴鸡狗猪",MOD(MID(L20,1,4)-4,12)+1,1) -> 马 | M21: =MID("鼠牛虎兔龙蛇马羊猴鸡狗猪",MOD(MID(M20,1,4)-4,12)+1,1) -> 蛇
A22: 虚岁 | B22: =M19+1 -> 73 | C22: =B22+1 -> 74 | D22: =C22+1 -> 75 | E22: =D22+1 -> 76 | F22: =E22+1 -> 77 | G22: =F22+1 -> 78 | H22: =G22+1 -> 79 | I22: =H22+1 -> 80 | J22: =I22+1 -> 81 | K22: =J22+1 -> 82 | L22: =K22+1 -> 83 | M22: =L22+1 -> 84
A23: 出生年份 | B23: =M20-1 -> 1940 | C23: =B23-1 -> 1939 | D23: =C23-1 -> 1938 | E23: =D23-1 -> 1937 | F23: =E23-1 -> 1936 | G23: =F23-1 -> 1935 | H23: =G23-1 -> 1934 | I23: =H23-1 -> 1933 | J23: =I23-1 -> 1932 | K23: =J23-1 -> 1931 | L23: =K23-1 -> 1930 | M23: =L23-1 -> 1929
A24: 生肖 | B24: =MID("鼠牛虎兔龙蛇马羊猴鸡狗猪",MOD(MID(B23,1,4)-4,12)+1,1) -> 龙 | C24: =MID("鼠牛虎兔龙蛇马羊猴鸡狗猪",MOD(MID(C23,1,4)-4,12)+1,1) -> 兔 | D24: =MID("鼠牛虎兔龙蛇马羊猴鸡狗猪",MOD(MID(D23,1,4)-4,12)+1,1) -> 虎 | E24: =MID("鼠牛虎兔龙蛇马羊猴鸡狗猪",MOD(MID(E23,1,4)-4,12)+1,1) -> 牛 | F24: =MID("鼠牛虎兔龙蛇马羊猴鸡狗猪",MOD(MID(F23,1,4)-4,12)+1,1) -> 鼠 | G24: =MID("鼠牛虎兔龙蛇马羊猴鸡狗猪",MOD(MID(G23,1,4)-4,12)+1,1) -> 猪 | H24: =MID("鼠牛虎兔龙蛇马羊猴鸡狗猪",MOD(MID(H23,1,4)-4,12)+1,1) -> 狗 | I24: =MID("鼠牛虎兔龙蛇马羊猴鸡狗猪",MOD(MID(I23,1,4)-4,12)+1,1) -> 鸡 | J24: =MID("鼠牛虎兔龙蛇马羊猴鸡狗猪",MOD(MID(J23,1,4)-4,12)+1,1) -> 猴 | K24: =MID("鼠牛虎兔龙蛇马羊猴鸡狗猪",MOD(MID(K23,1,4)-4,12)+1,1) -> 羊 | L24: =MID("鼠牛虎兔龙蛇马羊猴鸡狗猪",MOD(MID(L23,1,4)-4,12)+1,1) -> 马 | M24: =MID("鼠牛虎兔龙蛇马羊猴鸡狗猪",MOD(MID(M23,1,4)-4,12)+1,1) -> 蛇
A25: 虚岁 | B25: =M22+1 -> 85 | C25: =B25+1 -> 86 | D25: =C25+1 -> 87 | E25: =D25+1 -> 88 | F25: =E25+1 -> 89 | G25: =F25+1 -> 90 | H25: =G25+1 -> 91 | I25: =H25+1 -> 92 | J25: =I25+1 -> 93 | K25: =J25+1 -> 94 | L25: =K25+1 -> 95 | M25: =L25+1 -> 96
A26: 出生年份 | B26: =M23-1 -> 1928 | C26: =B26-1 -> 1927 | D26: =C26-1 -> 1926 | E26: =D26-1 -> 1925 | F26: =E26-1 -> 1924 | G26: =F26-1 -> 1923 | H26: =G26-1 -> 1922 | I26: =H26-1 -> 1921 | J26: =I26-1 -> 1920 | K26: =J26-1 -> 1919 | L26: =K26-1 -> 1918 | M26: =L26-1 -> 1917
A27: 生肖 | B27: =MID("鼠牛虎兔龙蛇马羊猴鸡狗猪",MOD(MID(B26,1,4)-4,12)+1,1) -> 龙 | C27: =MID("鼠牛虎兔龙蛇马羊猴鸡狗猪",MOD(MID(C26,1,4)-4,12)+1,1) -> 兔 | D27: =MID("鼠牛虎兔龙蛇马羊猴鸡狗猪",MOD(MID(D26,1,4)-4,12)+1,1) -> 虎 | E27: =MID("鼠牛虎兔龙蛇马羊猴鸡狗猪",MOD(MID(E26,1,4)-4,12)+1,1) -> 牛 | F27: =MID("鼠牛虎兔龙蛇马羊猴鸡狗猪",MOD(MID(F26,1,4)-4,12)+1,1) -> 鼠 | G27: =MID("鼠牛虎兔龙蛇马羊猴鸡狗猪",MOD(MID(G26,1,4)-4,12)+1,1) -> 猪 | H27: =MID("鼠牛虎兔龙蛇马羊猴鸡狗猪",MOD(MID(H26,1,4)-4,12)+1,1) -> 狗 | I27: =MID("鼠牛虎兔龙蛇马羊猴鸡狗猪",MOD(MID(I26,1,4)-4,12)+1,1) -> 鸡 | J27: =MID("鼠牛虎兔龙蛇马羊猴鸡狗猪",MOD(MID(J26,1,4)-4,12)+1,1) -> 猴 | K27: =MID("鼠牛虎兔龙蛇马羊猴鸡狗猪",MOD(MID(K26,1,4)-4,12)+1,1) -> 羊 | L27: =MID("鼠牛虎兔龙蛇马羊猴鸡狗猪",MOD(MID(L26,1,4)-4,12)+1,1) -> 马 | M27: =MID("鼠牛虎兔龙蛇马羊猴鸡狗猪",MOD(MID(M26,1,4)-4,12)+1,1) -> 蛇
A28: 虚岁 | B28: =M25+1 -> 97 | C28: =B28+1 -> 98 | D28: =C28+1 -> 99 | E28: =D28+1 -> 100 | F28: =E28+1 -> 101 | G28: =F28+1 -> 102 | H28: =G28+1 -> 103 | I28: =H28+1 -> 104 | J28: =I28+1 -> 105 | K28: =J28+1 -> 106 | L28: =K28+1 -> 107 | M28: =L28+1 -> 108
A29: 出生年份 | B29: =M26-1 -> 1916 | C29: =B29-1 -> 1915 | D29: =C29-1 -> 1914 | E29: =D29-1 -> 1913 | F29: =E29-1 -> 1912 | G29: =F29-1 -> 1911 | H29: =G29-1 -> 1910 | I29: =H29-1 -> 1909 | J29: =I29-1 -> 1908 | K29: =J29-1 -> 1907 | L29: =K29-1 -> 1906 | M29: =L29-1 -> 1905
A30: 生肖 | B30: =MID("鼠牛虎兔龙蛇马羊猴鸡狗猪",MOD(MID(B29,1,4)-4,12)+1,1) -> 龙 | C30: =MID("鼠牛虎兔龙蛇马羊猴鸡狗猪",MOD(MID(C29,1,4)-4,12)+1,1) -> 兔 | D30: =MID("鼠牛虎兔龙蛇马羊猴鸡狗猪",MOD(MID(D29,1,4)-4,12)+1,1) -> 虎 | E30: =MID("鼠牛虎兔龙蛇马羊猴鸡狗猪",MOD(MID(E29,1,4)-4,12)+1,1) -> 牛 | F30: =MID("鼠牛虎兔龙蛇马羊猴鸡狗猪",MOD(MID(F29,1,4)-4,12)+1,1) -> 鼠 | G30: =MID("鼠牛虎兔龙蛇马羊猴鸡狗猪",MOD(MID(G29,1,4)-4,12)+1,1) -> 猪 | H30: =MID("鼠牛虎兔龙蛇马羊猴鸡狗猪",MOD(MID(H29,1,4)-4,12)+1,1) -> 狗 | I30: =MID("鼠牛虎兔龙蛇马羊猴鸡狗猪",MOD(MID(I29,1,4)-4,12)+1,1) -> 鸡 | J30: =MID("鼠牛虎兔龙蛇马羊猴鸡狗猪",MOD(MID(J29,1,4)-4,12)+1,1) -> 猴 | K30: =MID("鼠牛虎兔龙蛇马羊猴鸡狗猪",MOD(MID(K29,1,4)-4,12)+1,1) -> 羊 | L30: =MID("鼠牛虎兔龙蛇马羊猴鸡狗猪",MOD(MID(L29,1,4)-4,12)+1,1) -> 马 | M30: =MID("鼠牛虎兔龙蛇马羊猴鸡狗猪",MOD(MID(M29,1,4)-4,12)+1,1) -> 蛇
A31: 虚岁 | B31: =M28+1 -> 109 | C31: =B31+1 -> 110 | D31: =C31+1 -> 111 | E31: =D31+1 -> 112 | F31: =E31+1 -> 113 | G31: =F31+1 -> 114 | H31: =G31+1 -> 115 | I31: =H31+1 -> 116 | J31: =I31+1 -> 117 | K31: =J31+1 -> 118 | L31: =K31+1 -> 119 | M31: =L31+1 -> 120
D32: 2024 | E32: 年岁数属相生肖对照表一网名张先生铆钉厂张东良