A1: zt快运石岩塘头东分站报价表 2022年9月5日
A2: TO： | E2: zt快运/***
A3: 省区 | B3: 分区 | C3: 目的地城市 | E3: 价格区间（1个方=200KG） | K3: 时效天
D4: 重量 | E4: 最低收费 | F4: 100KG内 | G4: 101-300KG | H4: 301-500KG | I4: 501-1000KG | J4: 1001kg以上
A5: 福建 | B5: 1区 | C5: 福州、厦门、泉州、 | D5: =E5/F5 -> 23.333333333333332 | E5: 35 | F5: 1.5 | G5: 1.3 | H5: 1.2 | I5: 1 | J5: 0.8 | K5: 42769.
B6: ２区 | C6: 莆田、龙岩、三明、漳州 | E6: 35 | F6: 1.5 | G6: 1.3 | H6: 1.2 | I6: 1 | J6: 0.8 | K6: 42769.
A7: 上海 | B7: １区 | C7: 松江、奉贤、闵行、青浦、嘉定、金山、浦东、闸北 | E7: 35 | F7: 1.5 | G7: 1.3 | H7: 1.2 | I7: 1 | J7: 0.8 | K7: 42769.
A8: 江苏 | B8: １区 | C8: 苏州、南京、无锡、常州、徐州、扬州 | E8: 35 | F8: 1.5 | G8: 1.3 | H8: 1.2 | I8: 1 | J8: 0.8 | K8: 42769.
B9: ２区 | C9: 淮安、泰州、镇江、连云港、盐城、南通 | E9: 35 | F9: 1.5 | G9: 1.3 | H9: 1.2 | I9: 1 | J9: 0.8 | K9: 42769.
A10: 浙江 | B10: １区 | C10: 杭州、宁波、温州、台州、金华 | E10: 35 | F10: 1.5 | G10: 1.3 | H10: 1.2 | I10: 1 | J10: 0.8 | K10: 42769.
B11: ２区 | C11: 绍兴、嘉兴、湖州、衢州、丽水、舟山、宁德 | E11: 35 | F11: 1.5 | G11: 1.3 | H11: 1.2 | I11: 1 | J11: 0.8 | K11: 42769.
A12: 安徽 | B12: １区 | C12: 合肥、蚌埠、芜湖、 | E12: 35 | F12: 1.5 | G12: 1.4 | H12: 1.3 | I12: 1.2 | J12: 1 | K12: 42769.
B13: ２区 | C13: 六安、淮南、阜阳、安庆、马鞍山、滁州、宿州、亳州、宣城、铜陵、池州 | E13: 35 | F13: 1.5 | G13: 1.4 | H13: 1.3 | I13: 1.2 | J13: 1 | K13: 42769.
A14: 湖南 | B14: １区 | C14: 长沙、衡阳 | E14: 35 | F14: 1.5 | G14: 1.4 | H14: 1.3 | I14: 1.2 | J14: 1 | K14: 42769.
B15: ２区 | C15: 株州、湘潭、常德、张家界、邵阳、娄底、益阳、永州、郴州、吉首、岳阳 | E15: 35 | F15: 1.5 | G15: 1.4 | H15: 1.3 | I15: 1.2 | J15: 1 | K15: 42769.
A16: 江西 | B16: １区 | C16: 南昌、赣州 | D16: =E16/F16 -> 21.875 | E16: 35 | F16: 1.6 | G16: 1.4 | H16: 1.3 | I16: 1.2 | J16: 1.1 | K16: 42769.
B17: ２区 | C17: 九江、宜昌、抚州、鹰潭、上饶、吉安、萍乡、景德镇、新余 | E17: 35 | F17: 1.6 | G17: 1.4 | H17: 1.3 | I17: 1.2 | J17: 1.1 | K17: 42769.
A18: 广西 | B18: １区 | C18: 南宁、桂林、柳州 | E18: 35 | F18: 1.6 | G18: 1.5 | H18: 1.4 | I18: 1.2 | J18: 1.1 | K18: 42769.
B19: ２区 | C19: 北海、防城港、百色、贵港、崇左、河池、梧州、钦州、玉林 | E19: 35 | F19: 1.6 | G19: 1.5 | H19: 1.4 | I19: 1.2 | J19: 1.1 | K19: 42769.
A20: 湖北 | B20: １区 | C20: 武汉、 | D20: =E20/F20 -> 25. | E20: 40 | F20: 1.6 | G20: 1.5 | H20: 1.4 | I20: 1.2 | J20: 1.1 | K20: 42798.
B21: ２区 | C21: 黄石、鄂州、咸宁、黄冈、孝感、天门、仙桃、潜江、十堰、荆州、宜昌、襄阳、荆门、随州、恩施 | E21: 40 | F21: 1.6 | G21: 1.5 | H21: 1.4 | I21: 1.2 | J21: 1.1 | K21: 42798.
A22: 北京 | B22: １区 | C22: 大兴、通州、朝阳、海淀 | D22: =E22/F22 -> 28.125 | E22: 45 | F22: 1.6 | G22: 1.5 | H22: 1.4 | I22: 1.3 | J22: 1.1 | K22: 42769.
B23: ２区 | C23: 石景、门头沟、平谷、顺义、怀柔、平昌、密云、延庆 | D23: =E23/F23 -> 26.47058823529412 | E23: 45 | F23: 1.7 | G23: 1.6 | H23: 1.4 | I23: 1.3 | J23: 1.1 | K23: 42769.
A24: 天津 | B24: １区 | C24: 津南、海滨新区、东丽 | D24: =E24/F24 -> 25. | E24: 45 | F24: 1.8 | G24: 1.6 | H24: 1.4 | I24: 1.3 | J24: 1.2 | K24: 42769.
B25: ２区 | C25: 武青、蓟县、宝抵、河西 | E25: 45 | F25: 1.8 | G25: 1.6 | H25: 1.4 | I25: 1.3 | J25: 1.2 | K25: 42769.
A26: 山东 | B26: １区 | C26: 济南、临沂、菏泽、济宁、潍坊、青岛 | D26: =E26/F26 -> 28.125 | E26: 45 | F26: 1.6 | G26: 1.5 | H26: 1.4 | I26: 1.3 | J26: 1.2 | K26: 42798.
B27: ２区 | C27: 聊城、德州、泰安、淄博、滨州、菏泽、东营、日照、烟台、威海 | E27: 45 | F27: 1.6 | G27: 1.5 | H27: 1.4 | I27: 1.3 | J27: 1.2 | K27: 42798.
A28: 河北 | B28: １区 | C28: 石家庄、唐山、廊方、 | E28: 45 | F28: 1.6 | G28: 1.5 | H28: 1.4 | I28: 1.3 | J28: 1.2 | K28: 42798.
B29: ２区 | C29: 邯郸、邢台、衡水、沧州、保定、秦皇岛、张家口 | E29: 45 | F29: 1.6 | G29: 1.5 | H29: 1.4 | I29: 1.3 | J29: 1.2 | K29: 42798.
A30: 河南 | B30: １区 | C30: 郑州 | D30: =E30/F30 -> 25. | E30: 45 | F30: 1.8 | G30: 1.6 | H30: 1.5 | I30: 1.3 | J30: 1.2 | K30: 42798.
B31: ２区 | C31: 许昌、安阳、平顶山、濮阳、商丘、周口、漯河、南阳、信阳、开封、鹤壁、济源、新乡、焦作、驻马店、洛阳、 | E31: 45 | F31: 1.8 | G31: 1.7 | H31: 1.6 | I31: 1.5 | J31: 1.2 | K31: 42798.
A32: 重庆 | B32: １区 | C32: 重庆、万州 | D32: =E32/F32 -> 27.777777777777779 | E32: 50 | F32: 1.8 | G32: 1.7 | H32: 1.6 | I32: 1.5 | J32: 1.3 | K32: 42798.
A33: 四川 | B33: １区 | C33: 成都市、南充、 | E33: 50 | F33: 1.8 | G33: 1.6 | H33: 1.5 | I33: 1.4 | J33: 1.2 | K33: 42798.
B34: ２区 | C34: 德阳、雅安、乐山、眉山、内江、自贡、资阳、绵阳、宜宾、泸州、甘孜、遂宁、达州、广安 | E34: 50 | F34: 1.8 | G34: 1.6 | H34: 1.5 | I34: 1.4 | J34: 1.2 | K34: 42798.
A35: 贵州 | B35: １区 | C35: 贵阳、遵义、安顺、兴义、都匀 | E35: 50 | F35: 1.8 | G35: 1.6 | H35: 1.5 | I35: 1.4 | J35: 1.2 | K35: 42798.
A36: 陕西 | B36: １区 | C36: 西安、咸阳 | E36: 50 | F36: 1.8 | G36: 1.6 | H36: 1.5 | I36: 1.4 | J36: 1.2 | K36: 42798.
B37: ２区 | C37: 宝鸡、延安、铜川、商洛、渭南、榆林、安康、汉中 | E37: 50 | F37: 1.8 | G37: 1.6 | H37: 1.5 | I37: 1.4 | J37: 1.2 | K37: 42798.
A38: 辽宁 | B38: １区 | C38: 沈阳、盘锦、大连 | D38: =E38/F38 -> 25. | E38: 50 | F38: 2 | G38: 1.8 | H38: 1.6 | I38: 1.5 | J38: 1.2 | K38: 42830.
B39: ２区 | C39: 抚顺、铁岭、通辽、辽阳、鞍山、丹东、朝阳、葫芦岛、锦州、本溪、营口、阜新 | E39: 50 | F39: 2 | G39: 1.8 | H39: 1.6 | I39: 1.5 | J39: 1.2 | K39: 42830.
A40: 吉林 | B40: １区 | C40: 长春 吉林、梅口河、白山、延边 | D40: =E40/F40 -> 22.727272727272727 | E40: 50 | F40: 2.2 | G40: 2 | H40: 1.8 | I40: 1.6 | J40: 1.3 | K40: 42830.
A41: 黑龙江 | B41: １区 | C41: 哈尔滨 | D41: =E41/F41 -> 24.999999999999996 | E41: 55 | F41: 2.2 | G41: 2 | H41: 1.8 | I41: 1.6 | J41: 1.3 | K41: 42830.
B42: ２区 | C42: 佳木斯、黑河、齐齐哈尔、大兴安岭、牡丹江、莫力达瓦达、鸡西、绥化、大庆 | E42: 55 | F42: 2.2 | G42: 2 | H42: 1.8 | I42: 1.6 | J42: 1.3 | K42: 42830.
A43: 云南 | B43: １区 | C43: 昆明 | E43: 55 | F43: 2.2 | G43: 2.1 | H43: 2 | I43: 1.8 | J43: 1.3 | K43: 42798.
B44: ２区 | C44: 曲靖、玉溪、西双版纳、文山、临沧、普洱、保山、大理、德宏、丽江、孟连、怒江、楚雄 | E44: 55 | F44: 2.2 | G44: 2.1 | H44: 2 | I44: 1.8 | J44: 1.3 | K44: 42798.
A45: 内蒙古 | B45: １区 | C45: 呼和浩特、包头、乌兰察布、赤峰 | D45: =E45/F45 -> 22. | E45: 55 | F45: 2.5 | G45: 2.3 | H45: 2.2 | I45: 1.8 | J45: 1.5 | K45: 42863.
A46: 宁夏 | B46: １区 | C46: 银川、石嘴山、吴忠、固原 | E46: 55 | F46: 2.5 | G46: 2.3 | H46: 2.2 | I46: 1.8 | J46: 1.5 | K46: 42863.
A47: 甘肃 | B47: １区 | C47: 兰州、天水 | E47: 55 | F47: 2.5 | G47: 2.3 | H47: 2.2 | I47: 1.8 | J47: 1.5 | K47: 42863.
A48: 青海 | B48: １区 | C48: 西宁 | E48: 55 | F48: 2.5 | G48: 2.3 | H48: 2.2 | I48: 1.8 | J48: 1.5 | K48: 42863.
A49: 营业部地址：石岩街道宝石南路
A51: 备注：1、以上报价不含税金、保价费、上楼费用、特殊区域派送费用 2、代收货款手续费用按：千分之七=0.007
A52: 3、单价计费不足最低消费按最低消费收取；
A53: 4、货物体积与实重取最大者计费。签回单另加收10元/票。计泡公式：长cm*宽cm*高cm/5000＝200KG